{
  "company_name": "GreenHarvest Foods",
  "person_name": "",
  "email": "anna@greenharvestfoods.com",
  "company_website": "https://greenharvestfoods.com",
  "country_or_market": "Poland",
  "notes": "Prefer companies that look ready for private-label frozen food sourcing. | GreenHarvest Foods imports frozen vegetables for retail and private label programs in Poland. | 先进入线索整理，再优先核对官网、LinkedIn 与联系人线索的一致性。 | Evidence Summary: 当前候选主要基于官网、LinkedIn、2 条可见联系人线索、数据源 fixture形成。 建议动作：ready_for_screening。 | Match Reason: 证据等级 A：来源：fixture；命中搜索查询：frozen mixed vegetables Poland importer；有官网主体线索；有 LinkedIn 公司页线索；搜索结果出现可见联系人或角色线索；命中当前搜索策略中的目标关键词组合。 | Source URL: https://greenharvestfoods.com | Source Type: web | Source Name: fixture | Source Note: https://greenharvestfoods.com | Freshness: unknown | Confidence: medium | Match Basis: 命中搜索查询：frozen mixed vegetables Poland importer | LinkedIn URL: https://www.linkedin.com/company/greenharvestfoods"
}
